project_number,Task completion,Correctness,Code quality,Architecture / maintainability,Simplicity vs overengineering,Overall project quality,overall_score,comment
1,10/10,9/10,8/10,9/10,8/10,9/10,88/100,"Empty folders (`types/`, `contexts/`, `utils/`, `components/`) remain in the project structure - should have been removed during prompt 5 simplification"
2,6/10,7/10,8/10,7/10,8/10,7/10,72/100,"CRITICAL: Profile page (Prompt 3) is completely missing - no `/profile` route, no ProfilePage component, no `updateProfile` method in AuthContext"
3,10/10,9/10,9/10,9/10,8/10,9/10,90/100,Project nested inside `auth-app/` subfolder - slightly unconventional structure for a benchmark submission
4,6/10,5/10,6/10,6/10,7/10,6/10,60/100,"CRITICAL: Profile page save functionality is fake - it shows ""Profile saved successfully!"" after 1 second timeout but does NOT actually update the user in context or localStorage. The code comment admits: ""To actually update the context, you would need to add an updateUser method to the auth service"""
5,10/10,7/10,7/10,8/10,6/10,8/10,76/100,HACKY: Profile update uses a workaround by calling `login()` again with hardcoded 'password' instead of having a proper `updateUser` method. This works because authService has fallback `credentials.password === 'password'` for any user.
6,9/10,9/10,8/10,7/10,7/10,8/10,80/100,`src/services/authService.ts` file exists but is empty - the auth logic remains in AuthContext.tsx instead of being properly extracted to the service layer
7,1/10,1/10,1/10,2/10,3/10,1/10,13/100,"Critical: No working entry point - Files named `App.ts` and `App.tsx.ts` (wrong extensions), no `main.tsx` or `index.tsx`"
8,6/10,7/10,8/10,7/10,6/10,7/10,68/100,"Critical: Profile page is NOT editable - Prompt 3 explicitly requires \""editable name and email\"" but Profile.tsx only displays user info with no form inputs for editing"
9,7/10,7/10,8/10,6/10,5/10,7/10,67/100,"Critical: Fabricated documentation - ARCHITECTURE.md and REFACTORING_SUMMARY.md describe AuthService, StorageService, and unit tests that DO NOT EXIST in the codebase"
10,5/10,5/10,6/10,7/10,7/10,6/10,60/100,"Critical: Snake game bug - Food collision detection has swapped coordinates (`newHead[0] === food.x` should be `newHead[0] === food.y`). The snake and food use different coordinate conventions (snake: [row,col], food: {x,y}) causing collision to never trigger correctly."
11,10/10,9/10,8/10,7/10,8/10,8/10,83/100,"README documentation is outdated and describes architecture (dependency injection, adapters, factory functions) that does not exist in the actual code"
12,10/10,8/10,7/10,6/10,9/10,7/10,78/100,"Prompt 2 (refactor auth for modularity and testability) was not meaningfully addressed - no separate services, utilities, or test files exist"
13,8/10,7/10,9/10,9/10,8/10,8/10,81/100,"Snake game does NOT display rules and controls - Prompt 4 explicitly requires ""There has to be rules and controls for the game written in this page"" but only shows score and a canvas"
14,3/10,5/10,7/10,7/10,6/10,4/10,42/100,Project explicitly failed at prompt 2 - tests were written but could not be fixed
15,9/10,7/10,7/10,5/10,7/10,7/10,70/100,"Prompt 2 not meaningfully addressed - auth logic is still in a single AuthContext.tsx file, no modular services or hooks extracted, no tests"
16,10/10,9/10,9/10,9/10,10/10,9/10,90/100,Repository hygiene: `node_modules/` and `dist/` are committed (should be in .gitignore)
17,3/10,6/10,6/10,4/10,2/10,4/10,40/100,"CRITICAL: Prompt 5 interpretation deleted all screens except Snake, destroying prompts 1-3 work"
18,10/10,9/10,9/10,9/10,8/10,9/10,90/100,CSS file is quite lengthy (~140 lines) - could be split but not a major issue
19,6/10,5/10,7/10,8/10,6/10,6/10,60/100,"CRITICAL: Snake game has stale closure bug - `snake` state in game loop is captured from closure, not updated properly"
20,10/10,7/10,7/10,7/10,5/10,7/10,70/100,CRITICAL: Snake game has stale closure bug - `checkCollision` uses `snake` from outer closure instead of `prevSnake` inside setState callback
21,4/10,3/10,6/10,6/10,5/10,4/10,28/100,"Critical bug in ProfilePage.tsx line 31: calls `useAuth().getCurrentUser()` but `getCurrentUser` is not a method on useAuth's return value (it exists on authService, not useAuth)"
22,10/10,9/10,8/10,8/10,9/10,9/10,53/60,App.css contains unused Vite boilerplate CSS (minor hygiene issue)
23,10/10,10/10,9/10,10/10,8/10,10/10,57/60,"Slightly more complex than necessary with multiple hook files (useLogin.ts, useProfile.ts) that could potentially be combined, but the separation improves testability"
24,10/10,9/10,8/10,8/10,9/10,9/10,53/60,No tests included (unlike project 23 which had comprehensive tests)
25,10/10,9/10,9/10,9/10,10/10,9/10,56/60,No tests included
